{
  "schema_version": "0.1.0",
  "experiment_id": "exp-0001-synthetic",
  "created_at": "2026-01-01T00:00:00Z",
  "dataset_version": "0.0.0-synthetic",
  "model": "example-tts-model",
  "model_version": "0.0.1",
  "configuration": { "batch_size": 8, "learning_rate": 0.0001 },
  "preprocessing_version": "0.1.0",
  "training_configuration": { "epochs": 0, "note": "SYNTHETIC placeholder, no training occurred" },
  "hardware": { "cpu": "example-cpu", "gpu": null },
  "software_versions": { "python": "3.11.15" },
  "metrics": {},
  "benchmark_results": null,
  "status": "planned",
  "notes": "SYNTHETIC example record for schema validation tests. No real experiment was run."
}
